,Unnamed: 0.1,Unnamed: 0,company,title,description,salary,tags,location,labels,link,index
30,30,3,Konvery Data,Large Model Project Intern (Resources),"Job Description: 1. Support the search and recruitment of human resources based on the data needs of large models; 2. Train and efficiently operate human resources to improve project production efficiency; 3. Cooperate with project managers to complete necessary communication and coordination. Job Requirements: 1. College students, graduating no later than June 2024, can guarantee internship time of more than 4 days a week for more than 3 months; 2. Those with experience in recruitment, community operation, etc. are preferred; 3. Have an understanding of artificial intelligence and large models, and can use large model tools at home and abroad; 4. Those with certain data processing capabilities and the ability to use low-code tools are preferred.",200-250 Yuan/day,"['Beijing', '4 days/week 3 months', 'Undergraduate']","2nd Floor, Sohu Network Building, Haidian District, Beijing","['Big Model', 'Artificial Intelligence', 'Community Operation']",https://www.zhipin.com/job_detail/cc1c4ee90d95c8271HZ629S6E1ZZ.html,
31,31,5,Konvery Data,Python Intern,"Job Responsibilities:* Support scripting technology work such as data subpackaging and format conversion of data projects, and continuously iterate related solutions;* Participate in the results and process analysis of data production projects, and propose and implement scale-up plans based on data to improve production efficiency;* Participate in other project-related work. Job Requirements:* Undergraduate/graduate students, majors in computer and software engineering/internship experience preferred; can work at least 4 days a week, and can intern for 6 months (2024.8-2025.2);* Have some Python programming experience, familiar with modules such as os, shutil, pandas, etc.; familiar with json format; understand Sql basic query, table association and other functions, and have a basic understanding of databases;* Interested in the AI ​​industry, good at understanding and learning, and strong communication skills.",200-230 yuan/day,"['Beijing', '4 days/week 6 months', 'Undergraduate']","2nd Floor, Sohu Network Building, Haidian District, Beijing","['Pandas', 'MySQL', 'json', 'Python']",https://www.zhipin.com/job_detail/baac7e8e977ec1391HF63di7GFdX.html,
32,32,7,Konvery Data,Operations Manager,"Job Description: 1. Recruit and operate talent resources through various means, including but not limited to campus cooperation, recruitment channels, social platforms, communities, etc.; 2. Sort out and analyze personnel portraits, iterate operating models, and improve the activity and output of personnel in the project; 3. Coordinate and communicate the work between project teams, promote the flow of information and work collaboration, and ensure the smooth progress of the project. Job Requirements: 1. Full-time undergraduate degree or above, more than 2 years of user/community operation experience is preferred. 2. Good logic, good communication skills, and the ability to quickly input and output information. 3. Have innovative ideas, can flexibly respond to changes and unknowns, are interested in artificial intelligence and large models, and can actively learn and explore new knowledge. 4. Have certain data analysis capabilities, and users who master data analysis tools are preferred.",13-25K,"['Beijing', '1-3 years', 'Undergraduate']","2nd Floor, Sohu Network Building, Haidian District, Beijing","['C-end users', 'community operation experience', 'good communication skills', 'good data analysis skills', 'do not accept working from home', 'user portrait and stratification', 'community building and maintenance', 'fine operation strategy design']",https://www.zhipin.com/job_detail/a2dcded9270317d21HZy2Nu_GFNS.html,
33,33,10,Konvery Data,Solutions Manager,"Job Responsibilities: 1. Communicate with customers, understand customer needs, provide professional product consulting and technical support; assist the team in developing sales strategies and plans, and provide customized solutions for potential customers. 2. Collect customer feedback, continuously improve products and services, and improve customer satisfaction. 3. Coordinate internal resources to ensure timely resolution of customer issues and improve customer experience. 4. Keep in touch with customers, maintain good customer relationships, and continuously explore service opportunities. Job Requirements: 1. Bachelor degree or above, computer science and other related majors are preferred. 2. About 5 years of business/pre-sales related experience, experience in the artificial intelligence data industry is preferred. 3. Have strong communication and expression skills, clear logic, open-minded thinking, and be able to communicate with customers in a professional consulting manner. 4. Have a team spirit and can actively participate in cross-departmental business cooperation. 5. Able to accept business trips. Bonus points for experience in the following industries: Enterprise Services·Big Data",25-35K·15 salary,"['Beijing', '5-10 years', 'Undergraduate']","2nd Floor, Sohu Network Building, Haidian District, Beijing","['Computer/communication related major', 'Pre-sales technical support experience', 'Able to adapt to business trips']",https://www.zhipin.com/job_detail/006cc61cc5a7b8881X1_3Nq4GFZU.html,
34,34,13,Konvery Data,Business Manager - Large Model Business,"Job Responsibilities: - Responsible for the company's business development in the large model industry and responsible for revenue; - Through industry insights and analysis, design/improve the architecture process of market development and customer service; - Promote business processes and complete the efficient conversion of business opportunities to revenue; - Flexibly coordinate internal and external resources based on a full understanding of customer needs to promote the efficient delivery of products and services; - Maintain and develop customer relationships, keep abreast of changes and trends in industry needs, and feedback to the internal team. Job Requirements: - Bachelor degree or above, more than 3 years of business work experience in artificial intelligence related industries, and those with work experience in the large model field are preferred; - Have good industry and market analysis capabilities, and be able to build methodology and knowledge base through framework thinking; - Customer-oriented and result-oriented, agile thinking, open-minded, and able to efficiently complete customer demand decomposition and resource allocation; - Good team management and internal collaboration capabilities.",20-35K·15 salary,"['Beijing', '3-5 years', 'Undergraduate']","2nd Floor, Sohu Network Building, Haidian District, Beijing","['Business negotiation ability', 'Resource integration ability', 'Project execution and promotion ability', 'To B sales experience']",https://www.zhipin.com/job_detail/e7a3652f8123c30c1Hdz2Ni5FlJT.html,
35,35,16,Konvery Data,Product Manager,"Job Responsibilities: 1. Formulate product planning and design: Responsible for formulating product development planning and design of data annotation platform according to market demand and business goals, including evaluation of product functions, performance and user experience. 2. User interface design: Responsible for designing the user interface of data annotation platform, including design of data annotation tools, improvement of user processes, etc., so as to better meet user needs and improve efficiency. 3. Project management: Responsible for collaborating with the team and managing projects, including communication and collaboration with development, design and operation teams to ensure that products can be completed on time and with quality. 4. Continuously improve products: Responsible for paying attention to changes in market and user needs, and continuously improving products, including improvement of product functions and performance, as well as improvement of user experience. Job Requirements: 1. Bachelor degree or above, computer, information engineering, statistics and other related majors are preferred. 2. About 2 years of product experience, those with experience in data annotation or artificial intelligence related industry products are preferred. 3. Proficient in product design and development related processes and tools, and have certain data analysis and mining capabilities. 4. Possess keen product thinking and insight, be able to deeply understand user needs, and propose innovative product solutions. 5. Have excellent communication and collaboration skills.",15-30K·15 salary,"['Beijing', '3-5 years', 'Undergraduate']","2nd Floor, Sohu Network Building, Haidian District, Beijing","['Middle/back-end products', 'AI products', 'Data products']",https://www.zhipin.com/job_detail/81a86ce935a76a8d1Xx92di-GFZR.html,
36,36,19,Konvery Data,Operations Manager,"Job Description: 1. Recruit and operate talent resources through various means, including but not limited to campus cooperation, recruitment channels, social platforms, communities, etc.; 2. Sort out and analyze personnel portraits, iterate operating models, and improve the activity and output of personnel in the project; 3. Coordinate and communicate the work between project teams, promote the flow of information and work collaboration, and ensure the smooth progress of the project. Job Requirements: 1. Full-time undergraduate degree or above, more than 2 years of user/community operation experience is preferred. 2. Good logic, good communication skills, and the ability to quickly input and output information. 3. Have innovative ideas, can flexibly respond to changes and unknowns, are interested in artificial intelligence and large models, and can actively learn and explore new knowledge. 4. Have certain data analysis capabilities, and users who master data analysis tools are preferred.",13-25K,"['Beijing', '1-3 years', 'Undergraduate']","2nd Floor, Sohu Network Building, Haidian District, Beijing","['Education and training', 'Technology', 'Workplace', 'Community data analysis', 'User refined operation', 'Promote user content production']",https://www.zhipin.com/job_detail/0decdf67141a4ca11HZy2Nu8FFZY.html,
37,37,0,Jing Lianwen,AI Data Labeling Intern (Zhijiang),"[Recruitment position]: AI data annotation management [Job details]: Understand the project annotation rules, use the corresponding software for annotation, annotate the content according to the annotation rules, and ensure the quality of data delivery. [Staff requirements]: Can intern for more than 1 month, work seriously, no leave without reason, need to work, no lateness or early departure. [Salary]: 150/day [Work address]: Zhijiang Laboratory, Yuhang District, Hangzhou [Working hours]: 9 am to 6 pm, two days off [Remarks]: Need to arrive at the post as soon as possible; excellent candidates can get an internship certificate; salary is settled monthly",140-150 Yuan/day,"['Hangzhou', '5 days/week 1 month', 'College']","7th Floor, Building E1, Hangzhou Bay Information Port, Xiaoshan District, Hangzhou","['Data annotation', 'Image annotation', 'Frame annotation']",https://www.zhipin.com/job_detail/3ed91c5275ce04be1HB639-6EldY.html,
38,38,2,Jing Lianwen,Project Manager (Military Industry),"Job Description: 1. Develop project plans: According to the strategic goals and market demands of military enterprises, as well as the specific conditions of scientific research projects, develop detailed scientific research project plans, clarify the goals, tasks, plans, progress and budget of the projects, and propose corresponding implementation plans; 2. Monitor project progress: Responsible for real-time monitoring of the progress and cost of the projects, timely discover and solve problems and risks in the projects, and ensure that the projects proceed smoothly as planned; 3. Manage project resources: Coordinate and effectively utilize resources inside and outside military enterprises, including docking with external cooperation and superior units, to ensure that the project tasks are successfully completed; 4. Quality management and risk control: According to the relevant standards and requirements of military enterprises, conduct quality management of scientific research projects, timely discover and solve problems and risks in the projects, and ensure the quality and progress of the projects; 5. Communication and coordination: Maintain good communication with project team members, superiors and other stakeholders, coordinate the opinions and needs of all parties to ensure the realization of project goals; 6. Project summary and archiving: After the project is completed, organize the project team to summarize and evaluate, and archive the project materials to provide reference for future work. Job requirements: 1. Education requirements: Bachelor degree or above, computer and other related majors, master's degree is preferred; 2. Work experience: at least 3 years of project management experience; familiar with artificial intelligence and big data related professional knowledge; experience in data collection and data annotation industry project management; 3. Skill requirements: strong ability to write various reports and plans, proficient in PPT, Word, Excel and other office software; PMP certificate; 4. Good independent work ability, customer relationship maintenance ability, communication and coordination organization ability and teamwork ability. 5. Able to adapt to short-term business trips when necessary.",10-15K,"['Beijing', '3-5 years', 'Undergraduate']","Room 902, 9th Floor, Building 1, No. 18 Yangfangdian Road, Guangyao Oriental Plaza, Building S, Haidian District, Beijing","['Computer-related major', 'Big data project management experience', 'Implementation and delivery experience']",https://www.zhipin.com/job_detail/abae0ce98195db2e1HB63N2_EVVZ.html,
39,39,5,Jing Lianwen,Business Manager (GPT Direction),"Job responsibilities: 1. Responsible for the development and maintenance of the AI ​​data service industry, coordinate internal resources, and complete personal quarterly and annual goals; 2. Data collection and annotation sales, undertake sales indicators: 3. Real-time grasp of customer needs, provide customers with integrated solutions; 4. Do a good job in project collaboration, follow up on the entire process of the project, do a good job in serving KA customers, and continuously improve the value of customer cooperation; 5. Maintain good communication with various channels, accumulate industry contacts, and effectively implement and promote industry business plans. Qualifications 1. Bachelor degree or above, marketing, computer and other related majors; more than 2 years of sales experience, with work experience in data services, technology and other related industries preferred; 2. Familiar with business negotiation and consulting marketing methods and skills, through effective speeches and negotiations, can obtain business opportunities, win customer recognition and maintain long-term customer relationships; 3. Able to accept business trips, regular social activities, and love sales work; 4. Good at communication, strong learning ability, strong communication skills and stress resistance.",12-20K,"['Hangzhou', '3-5 years', 'Undergraduate']","Hangzhou Xiaoshan District Hangzhou Jinglianwen Technology Co., Ltd. Information Port E-7","['Enterprise (To B)', 'Artificial Intelligence', 'Big Data', 'GPT']",https://www.zhipin.com/job_detail/499ccabb7e26d93d1HB42Nu0FFRS.html,
40,40,8,Jing Lianwen,Project Assistant Intern,"(Foreign language and related majors are preferred, preferably minor language majors)I. Job Description:1. After receiving the customer's cooperation intention, understand the customer's project requirements in detail2. Be responsible for the receipt, distribution, recovery and submission of data, and ensure data security at each step3. Be responsible for daily work in project progress4. Submit project reports, project results and logo documents on time, and monitor project quality at any time5. Other work assigned by the department manager6. Working hours: 9 am to 6 pm, two days off, statutory holidaysII. Job Requirements:1. Proficient in any foreign language, with the ability to read, write, listen and speak a foreign language, full-time undergraduate degree or above (foreign language majors are preferred, college or above with more than two years of work experience is also acceptable)2. Good writing foundation, familiar with office, word, excel, ppt3. Cheerful and outgoing personality, can learn and ask more at work; good at communicating with people, have strong communication skills, and can understand project requirements well4. Familiar with project management processes, have strong project monitoring capabilities; have a strong sense of responsibility and professionalism, and can withstand greater work pressure5. Have a driver's license",120-170 yuan/day,"['Hangzhou', '5 days/week 3 months', 'Undergraduate']","Block E, Hangzhou Bay Information Port, Xiaoshan District, Hangzhou","['Project Assistant', 'IT Project Management', 'Foreign Languages']",https://www.zhipin.com/job_detail/c57a8818e1446b001nR-3ty_FVtQ.html,
41,41,10,Jing Lianwen,Business Manager (GPT Business),"Job responsibilities: 1. Responsible for the development and maintenance of the AI ​​data service industry, coordinate internal resources, and complete personal quarterly and annual goals; 2. AIGC direction data sales, undertake sales targets: 3. Real-time grasp of customer needs, provide customers with integrated solutions; 4. Do a good job in project collaboration, follow up on the entire process of the project, do a good job in serving KA customers, and continuously improve the value of customer cooperation; 5. Maintain good communication with various channels, accumulate industry contacts, and effectively implement and promote industry business plans. Qualifications 1. Bachelor degree or above, marketing, computer and other related majors; more than 3 years of sales experience, must have AI industry experience, cloud service related experience is preferred; 2. Familiar with business negotiation and consulting marketing methods and skills, through effective speeches and negotiations, can obtain business opportunities, win customer recognition and maintain long-term customer relationships; 3. Able to accept business trips, regular social activities, and love sales work; 4. Good at communication, strong learning ability, strong communication skills and stress resistance.",15-25K,"['Hangzhou', '3-5 years', 'Undergraduate']","7th Floor, Building E1, Hangzhou Bay Information Port, Xiaoshan District, Hangzhou","['Sales experience to enterprises/institutions (To B)', 'Enterprise (To B)', 'Artificial Intelligence', 'GPT', 'Internet/Technology']",https://www.zhipin.com/job_detail/c03eda4043c99cfc1HB42Nu1GFNX.html,
42,42,13,Jing Lianwen,Project Manager,"Job Responsibilities: 1. Responsible for supervising the implementation of project management related systems, processes and standards, and timely correcting and improving them; 2. Evaluating and analyzing the needs of each project, and coordinating external resource needs; 4. Controlling the costs, team members and supplier resources of each project; 3. Schedule management: promoting project progress, timely and prudently handling major emergencies of the project, and ensuring that each project is carried out according to schedule; 4. Quality management: responsible for supervising the quality of each project; 5. Ensure that the project submits data in accordance with the construction period and quality standards agreed with the customer; 6. Customer relationship management: Conduct customer satisfaction surveys, analyze feedback results, and put forward improvement suggestions. Qualifications: 1. Priority is given to those with project management or team management experience 2. Bachelor degree or above, 12 years or more of work experience; 3. Priority is given to those with strong communication, organization, planning and management experience; 4. Certain project management experience, data or artificial intelligence industry experience is preferred; 5. Good at communication and coordination, strong sense of responsibility, and team awareness.",8-10K,"['Hangzhou', '1-3 years', 'Undergraduate']","7th Floor, Building E1, Hangzhou Bay Information Port, Xiaoshan District, Hangzhou","['Data collection', 'Data annotation']",https://www.zhipin.com/job_detail/cd61fe4ba407177b1HB639u8GFBU.html,
43,43,16,Jing Lianwen,Business Manager (GPT Direction),"Job responsibilities: 1. Responsible for the development and maintenance of the AI ​​data service industry, coordinate internal resources, and complete personal quarterly and annual goals; 2. Data collection and annotation sales, undertake sales targets: 3. Real-time grasp of customer needs, provide customers with integrated solutions; 4. Do a good job in project collaboration, follow up on the entire process of the project, do a good job in serving KA customers, and continuously improve the value of customer cooperation; 5. Maintain good communication with various channels, accumulate industry contacts, and effectively implement and promote industry business plans. Qualifications 1. Bachelor degree or above, marketing, computer and other related majors; more than 2 years of sales experience, with work experience in data services, technology and other related industries preferred; 2. Familiar with business negotiation and consulting marketing methods and skills, through effective speeches and negotiations, can obtain business opportunities, win customer recognition and maintain long-term customer relationships; 3. Able to accept short-term business trips, regular social activities, and love sales work; 4. Good at communication, strong learning ability, strong communication skills and stress resistance.",12-20K,"['Shenzhen', '3-5 years', 'Undergraduate']","Room 509, East Tower, Coastal Building, Nanshan District, Shenzhen","['Enterprise (To B)', 'Artificial Intelligence', 'Big Data', 'GPT']",https://www.zhipin.com/job_detail/7d15ac19604aba7c1HB42Nu6GFVV.html,
44,44,19,Jing Lianwen,Big Model Data Project Manager,"Job Responsibilities: 1. Customer Demand Analysis: Communicate with customers, understand customer needs and requirements, and analyze and understand them. 2. Project Execution: Complete data collection, processing and analysis in accordance with project requirements to ensure that the project is delivered on time. 3. Business Assistance: Cooperate with business to communicate with customers before and after sales services. 4. Customer Relationship Maintenance: Communicate with customers regularly, understand customer feedback and demand changes, and solve customer problems and meet customer needs in a timely manner. 5. Responsible for the preparation and management of project documents, including project plans, progress reports, acceptance documents, etc., to ensure the integrity and standardization of project materials 6. Teamwork: Work closely with other departments and team members to jointly achieve project goals. Ability Requirements: 1. Bachelor degree or above, science and engineering majors are preferred. 2. More than 2 years of project experience, with experience in project services for large mobile phone manufacturers and Internet manufacturers is preferred. 3. Have good communication and negotiation skills, be able to establish good relationships with customers and meet customer needs. 4. Have teamwork and organizational coordination skills, and be able to collaborate effectively with other departments and team members. 5. Have a strong interest and enthusiasm in the field of large model corpus data processing, and have the ability to continuously learn and innovate.",10-15K,"['Hangzhou', '1-3 years', 'Undergraduate']","7th Floor, Building E1, Hangzhou Bay Information Port, Xiaoshan District, Hangzhou","['Big Data Project Management Experience', 'AIGC', 'GPT']",https://www.zhipin.com/job_detail/dd4b7dda2a31d1521HF92dS6FVpZ.html,
