,Unnamed: 0.1,Unnamed: 0,company,title,description,salary,tags,location,labels,link,index
77,77,48,Data Hall,"Part-time French in Quebec, Canada","Work cycle: long-term part-timeWorking period per week: 2-3 daysWorking hours: unlimitedWorking period: unlimitedSettlement method: settlement after completionRecruitment deadline: 2024-07-12Part-time job: Online quality inspection of Quebec French. Job content: 1. According to the specifications, transcribe the voice content into language text2. According to the specifications, intercept the voice into sentences to judge the noise, effectiveness and other attributes, and operate according to the specifications. Job requirements: 1. The accuracy of the transcribed words must be 98% or above2. The accuracy of the label attributes must reach 85% or aboveWorking hours: flexible and you can work according to your own time every day. You can work part-time online at home and use the company platform for training.Salary: 120 yuan/effective hourSettlement method: Settlement on a monthly basis based on the data accepted by the customer",120-150 yuan/hour,"['Shenzhen', 'Experience not limited', 'College degree']","Room 803, Building 3, Phase II, Sunshine Yuehai Garden, No. 3818, Baishi Road, Yuegui Community, Yuehai Street, Nanshan District, Shenzhen, Guangdong Province",['part time'],https://www.zhipin.com/job_detail/9d47c1baf2efd3051HF83tu9EVdV.html,8.0
78,78,51,Data Hall,Norwegian translation,"Part-time job: Online quality inspection of Norwegian. Job content: 1. According to the specifications, transcribe the speech content into language text 2. According to the specifications, intercept the speech into sentences to judge the noise, effectiveness and other attributes, and operate according to the specifications. Job requirements: 1. The accuracy of the transcribed words must be 98% or above 2. The accuracy of the label attributes must reach 85% or above Working hours: Flexible and can work according to your own time every day. You can work part-time online at home and use the company platform for training. Salary: 120 yuan/effective hour Settlement method: Settlement on a monthly basis based on the data accepted by the customer",4-8K,"['Shenzhen', 'Experience required', 'Education required']","Room 803, Building 3, Phase II, Sunshine Yuehai Garden, No. 3818, Baishi Road, Yuegui Community, Yuehai Street, Nanshan District, Shenzhen, Guangdong Province","['Part-time job', 'No need to work']",https://www.zhipin.com/job_detail/74a330a48028f1b21HJ-39i6FVVX.html,11.0
79,79,54,Data Hall,Operations Engineer,"Job Description: Responsible for and participate in the deployment, operation and maintenance of the company's platform, database and various middleware, involving multiple scale servers, ensuring server stability and availability. Job Requirements: 1. Proficient in the configuration, management and optimization of the Linux operating system, and able to independently troubleshoot and solve various problems at the operating system layer; 2. Master the deployment of nginx, kafka, zabbix, docker, MongoDB, zookeeper, Samba, etc., and have practical deployment experience; 3. Familiar with MySQL database maintenance; 4. Can write simple Python scripts, understand Java, and have good system performance optimization and troubleshooting capabilities; 5. Assist in writing project-related documents; 6. Assist the project manager to complete project management work and promote project acceptance;",7-10K,"['Nanchang', '1-3 years', 'College']","No. 1588, Yingbin North Avenue, State Grid, Qingyunpu District, Nanchang, State Grid Jiangxi Electric Power Company, Electric Power Economics and Technology Research Institute","['Linux', 'Python', 'Java', 'Server Configuration', 'Container Technology', 'Distributed Technology', 'Nginx', 'Docker']",https://www.zhipin.com/job_detail/3602243ad3fb9dc61nZy3t64EVZU.html,14.0
80,80,57,Data Hall,Korean Sales Manager,"Job Responsibilities: 1. According to market conditions, develop domestic and foreign artificial intelligence big data markets; 2. Independently complete the company's data collection, sales of annotation products, and participate in the negotiation and signing of contracts; 3. Maintain existing old customer relationships, explore customer needs, and promote new orders; 4. Understand customer status, timely update, maintain, and analyze customer data; 5. Responsible for the tracking and delivery of customer orders, and handle after-sales issues. Job requirements: 1. Full-time undergraduate degree or above, computer and management related majors are preferred; those with overseas study background are preferred. 2. 1-3 years of sales experience, understanding of the Internet data industry, high acceptance of new things, and strong learning ability. 3. Have excellent problem-solving and communication skills; 4. Have the ability to independently expand into new areas and have momentum; 5. Strong sales development capabilities and a certain ability to withstand pressure. 6. TOPIK6, those with work experience in the automotive industry are preferred",15-25K,"['Beijing', '1-3 years', 'Undergraduate']","1st-4th Floor, Datatang (Beijing) Technology Co., Ltd., Haidian District, Beijing",['Korean'],https://www.zhipin.com/job_detail/c50a276ccaad62711HF_2di6EFVW.html,17.0
81,81,60,MindFlow,Key Account Sales Assistant,"[Job Responsibilities] 1. Customer relationship management, establish and maintain long-term cooperative relationships with customers, and promote customer renewal and additional purchases by providing high-value services; 2. Accurately identify and understand customer needs, and collect and analyze customer needs and feedback to form solutions; 3. Daily maintenance of customers, including consulting follow-up, problem handling, training and improvement, knowledge base summary and other support services; 4. Establish customer files, gain insight into the customer life cycle, and provide corresponding support for customers at different stages; 5. Organize and update technical manuals and other implementation documents, organize, mine and publicize typical customer cases. [Job Requirements] 1. Full-time unified enrollment with a bachelor's degree or above, 1-3 years of B-side business experience, those with autonomous driving background and customer success experience are preferred; 2. Clear thinking, strong logic, goal orientation, strong learning ability and research spirit; 3. Have keen market insight, good at discovering and analyzing industries, and understand industry development trends; 4. Be passionate about work and have an entrepreneurial spirit, and be able to withstand the pressure of rapid business expansion.",10-15K · 15 salary,"['Beijing', '1-3 years', 'Undergraduate']","Room 815, Building 1A, Block 1A, Wangjing SOHO T1A, Chaoyang District, Beijing","['Internet/Tech', 'Automobile', 'Communication Skills', 'Enterprise (To B)', 'Assist in developing new customers', 'Assist in maintaining customer relationships', 'Sales experience to institutions (To B)']",https://www.zhipin.com/job_detail/6a1bebc1981976311HN92du-EVFR.html,0.0
82,82,63,MindFlow,Manfu Technology is recruiting supply chain specialists,"Job Responsibilities1. Find and develop suitable suppliers in accordance with the company's supplier development management process2. Responsible for supplier performance evaluation and classification and grading management3. Responsible for the construction and maintenance of the supplier pool, and complete the matching of supplier resources according to the business4. Responsible for combining the supply and demand market, conducting price and cost research, and promoting the cost optimization of the business systemParticipate in the functional design of the supplier management system required by the above supplier managementJob Requirements1. Bachelor degree or above2. 3 years or more of cross-category supplier management experience in the Internet industry3. Those with experience in building supplier management systems are preferred.4. Sensitive to data, good at obtaining business changes from data changes and proficient in using data analysis tools;5. Have experience, understanding and enthusiasm for Internet products;6. Accept short-term business trips, about a week is preferred: at least 1 year of sourcing and procurement experience in artificial intelligence fields such as data labeling and collection, and with collection and labeling team resourcesOriginal title: ""Supply Chain Specialist""",9-14K · 16 salary,"['Beijing', '1-3 years', 'Undergraduate']","Room 0815, Block 1A, Wangjing SOHO, Chaoyang District, Beijing","['Good English skills', 'Experience in medium to large supply chain management']",https://www.zhipin.com/job_detail/ff810c736dbf45081HJ_39q4EVBQ.html,3.0
83,83,66,MindFlow,Product Manager,"Job Responsibilities1. Develop the company's strategic plan with the management team, and promote the company to become the industry's TOP1 within 3 years, with a market share of over 70%;2. According to the company's strategy and industry development trends, the management team develops AI product planning and implementation;3. Continuously explore user needs for product innovation, coordinate internal and external resources to promote product function realization and continuous iteration;4. Responsible for product life cycle management, product market competition analysis, and new product project management. Job Requirements1. Full-time undergraduate or above, 985&211 undergraduate or above;2. Have an extremely sensitive business sense, and know the development history and competitive strategies of technology companies;3. Pay close attention to business data and be good at adjusting product strategies by analyzing business data;4. More than 3 years of experience in Internet data platform products or scheduling platform development related work experience;5. Familiar with the process and details of SAAS product and middle-end product design and development;6. Proficient in product prototypes, flow charts, mind maps and other related tools, and proficient in SQL;7. Good product analysis and design ideas, strong logical analysis ability, excellent cross-departmental communication ability, excellent rapid learning ability, and excellent execution;Preferred conditions:1. Have relevant work experience or work cases in the field of artificial intelligence products; [We provide you with] 1. Professional and systematic training mechanism: new employee training + department training + management training + job skills training; 2. Your benefits: paid annual leave + irregular dinners + holiday benefits + birthday parties + performance bonuses; 3. A happy working environment, an office environment with a strong learning culture, and a team of partners with a high talent density; 4. Convenient transportation conditions, Wangjing SOHO is very convenient for shopping and eating.",20-40K·18 salary,"['Beijing', '3-5 years', 'Undergraduate']","Room 0815, Block 1A, SOHOT, Wangjing, Chaoyang District, Beijing","['Functional products', 'Strategic products', 'AI products', 'Platform products', 'SAAS products', 'B-end products', 'Market research', 'Product planning']",https://www.zhipin.com/job_detail/cf1d95af6ce8b2cc1XR72Nm8FFRU.html,6.0
84,84,69,MindFlow,Operations Engineer,"Job Responsibilities: 1. Responsible for the deployment, monitoring, and operation and maintenance of the local Docker/K8S virtualization platform; 2. Responsible for the daily operation and maintenance of various cloud services in the public cloud. The scope of cloud services includes: basic services such as computing, storage, containers, virtual networks, and advanced services such as PAAS, EI, AI, and global services. 3. Participate in the development of operation and maintenance automation scripts, and actively realize container operation and maintenance automation; 4. Write and continuously improve system operation and maintenance manuals, deployment documents, and performance parameter descriptions; 5. Emergency response and technical support for various faults and transactions. Job Requirements: 1. Bachelor degree or above from a full-time regular college, majoring in computer, software, communication, information, etc.; 2. More than 3 years of operation and maintenance experience in large-scale complex production environments; 3. In-depth understanding of Linux systems and optimization, proficient in shell/python; Priority conditions: 1. Those with experience in well-known Internet companies;",11-16K·15 Salary,"['Hangzhou', '3-5 years', 'Undergraduate']","Room 1202, 12th Floor, Liaison Building, Binjiang District, Hangzhou","['Docker', 'Operation and development experience', 'Operation and maintenance experience']",https://www.zhipin.com/job_detail/93dabab5fb75ca701HNz0ty0FVdV.html,9.0
85,85,72,MindFlow,Intermediate and senior test engineers,"Job Responsibilities: 1. Participate in the whole process of Manfu's related business platform testing, including participating in demand analysis, design review, formulating test plans, designing and executing test cases, conducting defect tracking and software quality analysis, etc.; 2. Weave software test reports and evaluate quality; 3. Formulate test processes and related standards; Job Requirements: 1. Bachelor degree or above from a full-time regular college, majoring in computer, software, communication, information and other related majors; 2. More than 2-3 years of testing experience (excluding internship), not outsourced; 3. Proficient in at least one programming language such as python, shell, go, java, and familiar with Linux system; 4. Strong self-drive and management ability in the face of work goals, passion and responsibility, excellent team communication and collaboration skills, and treat work and colleagues with an open mind, humility and a positive and optimistic attitude; Preferred Conditions: 1. Experience in annotated page testing 2. Experience in medium and large distributed system testing is preferred; 3. Experience in interface and UI automation testing is preferred; 4. Experience in working in well-known Internet companies;",11-16K·15 Salary,"['Beijing', '1-3 years', 'Undergraduate']","Room 815, Building 1A, Block 1A, Wangjing SOHO T1A, Chaoyang District, Beijing","['Automated testing', 'Functional testing', 'Performance testing', 'Testing experience', 'Automated testing experience']",https://www.zhipin.com/job_detail/527e1e12ef9e095f1HR-0tm_E1ZW.html,12.0
86,86,75,MindFlow,Senior Product Manager,"Job Description1. Responsible for the demand definition and iteration of a platform product line of the company, including the management of user capacity, mining and definition of user tags, design of user matching strategies, statistics and analysis of data, and responsible for the value of the final product;2. Coordinate resources to promote the implementation of product functions, follow up on project progress, and improve the overall quality and development efficiency of the project;3. Responsible for the function promotion work after the product is launched, communicate effectively with internal and external teams of the company, enhance the penetration of new products in the business team, and collect relevant feedback to continuously promote product optimization. Job Requirements1. Bachelor degree or above, 3 years of product experience, with artificial intelligence, big data related industry background preferred;2. Good product analysis, summary and induction skills, good cross-team communication and coordination skills, strong stress resistance;3. Priority is given to those with experience in strategic products such as advertising engines and recommendation systems;4. Priority is given to those with team management experience. Bonus points: Experience in the following industries: Internet",20-40K·16 salary,"['Beijing', '3-5 years', 'Undergraduate']","Room 0815, Block 1A, SOHOT, Wangjing, Chaoyang District, Beijing","['Functional products', 'Strategic products', 'Product design', 'Data products', 'AI products', 'Platform products', 'Middle platform products', 'SAAS products']",https://www.zhipin.com/job_detail/a7da106d21e5bc301Xd50tq9FlJT.html,15.0
87,87,78,MindFlow,Product Manager,"Salary is negotiable~Job responsibilities1. Responsible for the implementation of annotation platform tool products, and improve the efficiency and quality of autonomous driving 3D/4D data annotation by optimizing tool modes, processes, and operations2. Responsible for combining AI capabilities with annotation tools, paying attention to market trends in the annotation industry, analyzing the pros and cons of competing products, and continuously creating products with core competitiveness3. In-depth business scenarios, insight into industry pain points and annotation/acceptance needs, and collaborative upstream and downstream to promote product iterative development4. Pursue the ultimate experience of annotation and acceptance, be responsible for efficiency and ease of use, track the entire process and continue to polishJob requirements1.985/211 undergraduate degree or above, computer, software engineering, design and related majors preferred2.2 years or more of ToB product experience, with tool product experience preferred.3. Have a clear logical thinking framework, be sensitive to business data, and be good at analyzing the truth and core causes behind the problem4. Have a keen understanding of user behavior and business processes, and have the insight and judgment to discover problems. 5. Strong initiative, able to work with goals and results in a self-driven manner 6. Excellent cross-team collaboration ability, able to coordinate business, technology, and algorithm teams to achieve business results Bonus points Background in artificial intelligence and new energy related industries Experience in annotation tools or design related tool products",18-30K·15 salary,"['Beijing', '1-3 years', 'Undergraduate']","Room 815, Building 1A, Block 1A, Wangjing SOHO T1A, Chaoyang District, Beijing","['B-end products', 'Marking products', 'Design products', 'Tool products']",https://www.zhipin.com/job_detail/d3954d54f96cc5df1HB729W6GVdX.html,18.0
88,88,80,Konvery Data,Business BD,"Job Responsibilities: - Responsible for the company's business development in the designated industry field and responsible for revenue; - Through industry insights and analysis, design/improve the architecture process of market development and customer service; - Lead BD, flexibly coordinate internal and external resources based on a full understanding of customer needs, and promote the efficient delivery of products and services; - Maintain and develop customer relationships, keep abreast of changes and trends in industry needs, and feedback to the internal team. Job Requirements: - Bachelor degree or above, more than 3 years of business work experience, experience in the field of autonomous driving is preferred; - Have good industry and market analysis capabilities, and be able to build methodology and knowledge base through framework thinking; - Customer-oriented and result-oriented, agile thinking, open-minded, able to efficiently complete customer demand decomposition and resource allocation; - Good team management and internal collaboration capabilities; - Having resources in the field of autonomous driving is a plus.",20-40K·15 salary,"['Beijing', '3-5 years', 'Undergraduate']","2nd Floor, Sohu Network Building, Haidian District, Beijing","['Channel cooperation', 'Business negotiation ability', 'Key customers', 'Key customer sales experience', 'Business development', 'Bidding work', 'Internet/technology', 'Sales', 'Business negotiation']",https://www.zhipin.com/job_detail/af0b1b29410f336e1XZ53N65F1dW.html,0.0
89,89,83,Konvery Data,Large Model Project Intern (Resources),"Job Description: 1. Support the search and recruitment of human resources based on the data needs of large models; 2. Train and efficiently operate human resources to improve project production efficiency; 3. Cooperate with project managers to complete necessary communication and coordination. Job Requirements: 1. College students, graduating no later than June 2024, can guarantee internship time of more than 4 days a week for more than 3 months; 2. Those with experience in recruitment, community operation, etc. are preferred; 3. Have an understanding of artificial intelligence and large models, and can use large model tools at home and abroad; 4. Those with certain data processing capabilities and the ability to use low-code tools are preferred.",200-250 Yuan/day,"['Beijing', '4 days/week 3 months', 'Undergraduate']","2nd Floor, Sohu Network Building, Haidian District, Beijing","['Big Model', 'Artificial Intelligence', 'Community Operation']",https://www.zhipin.com/job_detail/cc1c4ee90d95c8271HZ629S6E1ZZ.html,3.0
90,90,85,Konvery Data,Python Intern,"Job Responsibilities:* Support scripting technology work such as data subpackaging and format conversion of data projects, and continuously iterate related solutions;* Participate in the results and process analysis of data production projects, and propose and implement scale-up plans based on data to improve production efficiency;* Participate in other project-related work. Job Requirements:* Undergraduate/graduate students, majors in computer and software engineering/internship experience preferred; can work at least 4 days a week, and can intern for 6 months (2024.8-2025.2);* Have some Python programming experience, familiar with modules such as os, shutil, pandas, etc.; familiar with json format; understand Sql basic query, table association and other functions, and have a basic understanding of databases;* Interested in the AI ​​industry, good at understanding and learning, and strong communication skills.",200-230 yuan/day,"['Beijing', '4 days/week 6 months', 'Undergraduate']","2nd Floor, Sohu Network Building, Haidian District, Beijing","['Pandas', 'MySQL', 'json', 'Python']",https://www.zhipin.com/job_detail/baac7e8e977ec1391HF63di7GFdX.html,5.0
91,91,87,Konvery Data,Solutions Manager,"Job Responsibilities: 1. Communicate with customers, understand customer needs, provide professional product consulting and technical support; assist the team in developing sales strategies and plans, and provide customized solutions for potential customers. 2. Collect customer feedback, continuously improve products and services, and improve customer satisfaction. 3. Coordinate internal resources to ensure timely resolution of customer issues and improve customer experience. 4. Keep in touch with customers, maintain good customer relationships, and continuously explore service opportunities. Job Requirements: 1. Bachelor degree or above, computer science and other related majors are preferred. 2. About 5 years of business/pre-sales related experience, experience in the artificial intelligence data industry is preferred. 3. Have strong communication and expression skills, clear logic, open-minded thinking, and be able to communicate with customers in a professional consulting manner. 4. Have a team spirit and can actively participate in cross-departmental business cooperation. 5. Able to accept business trips. Bonus points for experience in the following industries: Enterprise Services·Big Data",25-35K·15 salary,"['Beijing', '5-10 years', 'Undergraduate']","2nd Floor, Sohu Network Building, Haidian District, Beijing","['Computer/communication related major', 'Pre-sales technical support experience', 'Able to adapt to business trips']",https://www.zhipin.com/job_detail/006cc61cc5a7b8881X1_3Nq4GFZU.html,7.0
92,92,90,Konvery Data,Business Manager - Large Model Business,"Job Responsibilities: - Responsible for the company's business development in the large model industry and responsible for revenue; - Through industry insights and analysis, design/improve the architecture process of market development and customer service; - Promote business processes and complete the efficient conversion of business opportunities to revenue; - Flexibly coordinate internal and external resources based on a full understanding of customer needs to promote the efficient delivery of products and services; - Maintain and develop customer relationships, keep abreast of changes and trends in industry needs, and feedback to the internal team. Job Requirements: - Bachelor degree or above, more than 3 years of business work experience in artificial intelligence related industries, and those with work experience in the large model field are preferred; - Have good industry and market analysis capabilities, and be able to build methodology and knowledge base through framework thinking; - Customer-oriented and result-oriented, agile thinking, open-minded, and able to efficiently complete customer demand decomposition and resource allocation; - Good team management and internal collaboration capabilities.",20-35K·15 salary,"['Beijing', '3-5 years', 'Undergraduate']","2nd Floor, Sohu Network Building, Haidian District, Beijing","['Business negotiation ability', 'Resource integration ability', 'Project execution and promotion ability', 'To B sales experience']",https://www.zhipin.com/job_detail/e7a3652f8123c30c1Hdz2Ni5FlJT.html,10.0
